-- Sign in / sign up process
-- Add user
INSERT INTO Users (userName, pwd) VALUES ('wwan', 'test');

Query OK, 1 row affected (0.00 sec)

-- Check userName
SELECT * FROM Users where userName LIKE 'wwan';

+----------+------+
| userName | pwd  |
+----------+------+
| wwan     | test |
+----------+------+
1 row in set (0.00 sec)

-- Check password
SELECT pwd FROM Users where userName LIKE 'wwan';

+------+
| pwd  |
+------+
| test |
+------+
1 row in set (0.00 sec)

-- Reviews
-- Add review
INSERT INTO Reviews (userName, mID, rating, comment, dt) VALUES ('wwan', 1, 5, 'nice song!', curdate());

Query OK, 1 row affected (0.00 sec)

-- Show all reviews
SELECT * FROM Reviews;

+-----+----------+------+--------+------------+------------+
| rID | userName | mID  | rating | comment    | dt         |
+-----+----------+------+--------+------------+------------+
|   1 | wwan     |    1 |      5 | nice song! | 2023-07-10 |
+-----+----------+------+--------+------------+------------+
1 row in set (0.00 sec)


-- Show all reviews of a user from most recent to lease recent
INSERT INTO Reviews (userName, mID, rating, comment, dt) VALUES ('wwan', 2, 4, 'not bad!', '2023-07-09');

Query OK, 1 row affected (0.01 sec)

SELECT * FROM Reviews WHERE userName LIKE 'wwan' order by dt DESC;

+-----+----------+------+--------+------------+------------+
| rID | userName | mID  | rating | comment    | dt         |
+-----+----------+------+--------+------------+------------+
|   1 | wwan     |    1 |      5 | nice song! | 2023-07-10 |
|   2 | wwan     |    2 |      4 | not bad!   | 2023-07-09 |
+-----+----------+------+--------+------------+------------+
2 rows in set (0.00 sec)

-- Show all reviews of a song from most recent to lease recent
INSERT INTO Reviews (userName, mID, rating, comment, dt) VALUES ('wwan', 1, 3, 'ok!', '2023-07-08');

Query OK, 1 row affected (0.01 sec)

INSERT INTO Reviews (userName, mID, rating, comment, dt) VALUES ('wwan', 1, 0, 'bad!', '2023-07-09');

Query OK, 1 row affected (0.00 sec)

SELECT * FROM Reviews WHERE mID = 1 order by dt DESC;

+-----+----------+------+--------+------------+------------+
| rID | userName | mID  | rating | comment    | dt         |
+-----+----------+------+--------+------------+------------+
|   1 | wwan     |    1 |      5 | nice song! | 2023-07-10 |
|   4 | wwan     |    1 |      0 | bad!       | 2023-07-09 |
|   3 | wwan     |    1 |      3 | ok!        | 2023-07-08 |
+-----+----------+------+--------+------------+------------+
3 rows in set (0.01 sec)

-- Show top five songs by users' reviews (top five in average ratings)
INSERT INTO Reviews (userName, mID, rating, comment, dt) VALUES ('wwan', 3, 5, 'love it!', curdate());

Query OK, 1 row affected (0.01 sec)

INSERT INTO Reviews (userName, mID, rating, comment, dt) VALUES ('wwan', 4, 0, 'hate it!', curdate());

Query OK, 1 row affected (0.00 sec)

INSERT INTO Reviews (userName, mID, rating, comment, dt) VALUES ('wwan', 5, 2, 'dislike!', curdate());

Query OK, 1 row affected (0.00 sec)

SELECT mName, aName, genre FROM Reviews NATURAL JOIN Musics GROUP BY mID ORDER BY AVG(rating) DESC LIMIT 5;

+----------------------+----------------------+-------+
| mName                | aName                | genre |
+----------------------+----------------------+-------+
| cry                  | johnnie ray          | pop   |
| i believe            | frankie laine        | pop   |
| mohabbat bhi jhoothi | mukesh               | pop   |
| apopse eida oneiro   | giorgos papadopoulos | pop   |
| patricia             | p√©rez prado         | pop   |
+----------------------+----------------------+-------+
5 rows in set (0.01 sec)

-- The favorite actist, song and genre of a user (based on their rating)
SELECT mName, aName, genre, AVG(rating) as rating FROM Reviews NATURAL JOIN Users NATURAL JOIN Musics WHERE userName LIKE 'wwan' GROUP BY mID HAVING AVG(rating) > 3 ORDER BY AVG(rating) DESC LIMIT 1;

+-------+-------------+-------+--------+
| mName | aName       | genre | rating |
+-------+-------------+-------+--------+
| cry   | johnnie ray | pop   | 5.0000 |
+-------+-------------+-------+--------+
1 row in set (0.01 sec)

-- Assume user with username testUser1 deletes his account, so his reviews will be deleted as well
DELETE FROM Users WHERE userName LIKE 'wwan';

Query OK, 1 row affected (0.00 sec)

SELECT * FROM Users;

Empty set (0.00 sec)

SELECT * FROM Reviews;

Empty set (0.00 sec)

-- Recommend songs by users' reviews
-- If he likes blues
SELECT mName, aName, genre FROM Musics WHERE genre LIKE 'blues' LIMIT 5;

+----------------------------+-----------------+-------+
| mName                      | aName           | genre |
+----------------------------+-----------------+-------+
| how about rocking with me  | piney brown     | blues |
| midnight blues             | the ravens      | blues |
| gotta find my baby         | the ravens      | blues |
| you're gonna lose your gal | the ravens      | blues |
| i've got a crush on you    | ella fitzgerald | blues |
+----------------------------+-----------------+-------+
5 rows in set (0.02 sec)

-- If he does not like blues
SELECT mName, aName, genre FROM Musics WHERE genre NOT LIKE 'blues' LIMIT 5;

+----------------------+----------------------+-------+
| mName                | aName                | genre |
+----------------------+----------------------+-------+
| mohabbat bhi jhoothi | mukesh               | pop   |
| i believe            | frankie laine        | pop   |
| cry                  | johnnie ray          | pop   |
| patricia             | p√©rez prado         | pop   |
| apopse eida oneiro   | giorgos papadopoulos | pop   |
+----------------------+----------------------+-------+
5 rows in set (0.00 sec)
